{
  "schema_version": "trace/v1",
  "relation": "task_run_started",
  "from_ref": {
    "logical_id": "lane:lane-42"
  },
  "to_ref": {
    "logical_id": "task_run:9f2c9c2e-6b4b-4d0a-9a3d-6a2f7a1c9e10"
  },
  "occurred_at": "2026-08-01T08:55:00Z",
  "actor": {
    "kind": "human"
  },
  "task_run_id": "9f2c9c2e-6b4b-4d0a-9a3d-6a2f7a1c9e10",
  "lane_id": "lane-42",
  "event_id": "tr1_a00472e5653d8b217b932c5184e8ee42947c04b84ac4c50342e8eebec1d363ca"
}
