{
  "schema_version": "trace/v1",
  "relation": "usage_imported",
  "from_ref": {
    "logical_id": "session:11111111-1111-4111-8111-111111111111"
  },
  "to_ref": {
    "logical_id": "task_run:9f2c9c2e-6b4b-4d0a-9a3d-6a2f7a1c9e10"
  },
  "occurred_at": "2026-08-01T10:30:00Z",
  "actor": {
    "kind": "cli",
    "id": "lane",
    "version": "0.4.0"
  },
  "task_run_id": "9f2c9c2e-6b4b-4d0a-9a3d-6a2f7a1c9e10",
  "session_id": "11111111-1111-4111-8111-111111111111",
  "payload": {
    "window": {
      "since": "2026-08-01T09:00:00Z",
      "until": "2026-08-01T10:00:00Z"
    },
    "source": "agent-cost"
  },
  "event_id": "tr1_62550f0fbdef5bc565c940c6d6429278dc505f20f14aa37df50af7ee1a065b3c"
}
