{
  "schema_version": "trace/v1",
  "relation": "declares",
  "from_ref": {
    "logical_id": "task_run:9f2c9c2e-6b4b-4d0a-9a3d-6a2f7a1c9e10"
  },
  "to_ref": {
    "logical_id": "decision.yaml",
    "content_digest": "sha256:eeeeeeeeeeeeeeeeeeeeeeeeeeeeeeeeeeeeeeeeeeeeeeeeeeeeeeeeeeeeeeee"
  },
  "occurred_at": "2026-08-02T09:30:00Z",
  "actor": {
    "kind": "human"
  },
  "task_run_id": "9f2c9c2e-6b4b-4d0a-9a3d-6a2f7a1c9e10",
  "lane_id": "lane-42",
  "payload": {
    "note": "corrected: fixed a typo in the declaration note, content unchanged"
  },
  "supersedes_event_id": "tr1_f1efe6457cf339690b3e237b5422f9a8e109379f2ba99434fa5e35db2ad1c4f6",
  "event_id": "tr1_31d4ea143e290c7ff7169692faf202376922fae2d97b8ed0b829fe5ce1f69fd8"
}
