{
  "schema_version": "trace/v1",
  "relation": "declares",
  "from_ref": {
    "logical_id": "task_run:9f2c9c2e-6b4b-4d0a-9a3d-6a2f7a1c9e10"
  },
  "to_ref": {
    "logical_id": "intent.yaml",
    "content_digest": "sha256:aaaaaaaaaaaaaaaaaaaaaaaaaaaaaaaaaaaaaaaaaaaaaaaaaaaaaaaaaaaaaaaa"
  },
  "occurred_at": "2026-08-01T09:10:00Z",
  "actor": {
    "kind": "human"
  },
  "task_run_id": "9f2c9c2e-6b4b-4d0a-9a3d-6a2f7a1c9e10",
  "lane_id": "lane-42",
  "event_id": "tr1_ea11d9e2eeda39a566207db509937e0788365081be5a1e34e10a193288283d4c"
}
